Priority,Urgency,Status,Incident Number,Requestor,Email,Short Description,Long Description,Phone,Days Open,,
2024-09-18,4,1,open,17101,Elizabeth Smith,elizabeth.smith@austx.com,"Network outage causing disruption in email communication, Long Description: A network outage occurred today in our office, leading to a disruption in email communication for all employees. The IT team is currently investigating the issue to identify the root cause and restore connectivity as soon as possible. This incident is impacting our ability to send and receive important emails, affecting our daily operations. Employees are advised to use alternative communication methods until the issue is resolved.",,5121737395,12,
2024-03-29,2,1,open,70100,Kenneth Williams,kenneth.williams@austx.com,"Data breach discovered in the company's database, Long Description: Our company has discovered a data breach in our database, potentially compromising sensitive information of both employees and clients. The IT security team has immediately initiated an incident response plan to contain the breach, assess the extent of the damage, and implement necessary measures to prevent further data loss. Users are advised to change their passwords and be cautious of any suspicious activity related to their accounts. The company is also working on enhancing its cybersecurity measures to prevent future breaches.",,5125020330,10,
2025-02-11,3,4,closed,57901,Stephen Campbell,stephen.campbell@austx.com,"Network outage causing disruption in accessing critical systems, Long Description: Employees at a medium-sized enterprise experienced a network outage that disrupted access to critical systems and applications. The incident occurred suddenly during peak working hours, leading to confusion and frustration among the staff members. The IT team quickly identified the issue as a network failure and began troubleshooting to restore connectivity. As the outage persisted, employees started discussing the impact on their daily tasks and productivity. Some employees reported being unable to access important files stored on the network drives, while others struggled to communicate with colleagues through internal messaging platforms. The IT team provided periodic updates on their progress, reassuring employees that they were working diligently to resolve the issue. After several hours of troubleshooting, the network was finally restored, and normal operations resumed. Post-incident, a meeting was held to discuss the root cause of the outage and implement preventive measures to minimize the risk of future disruptions.",,5128902554,29,
2024-07-10,4,4,open,55747,Barbara Wright,barbara.wright@austx.com,Users are experiencing difficulty accessing the company's email server.,"Employees at a medium-sized enterprise have reported issues with accessing their emails through the company's server. The IT team is investigating the root cause of the problem, which seems to be affecting multiple users across different departments. Some employees have resorted to using personal email accounts in the meantime, causing potential security risks. The IT helpdesk has been inundated with support tickets related to this email server issue, and users are growing increasingly frustrated with the lack of communication regarding the issue resolution timeline. Discussions among employees have sparked concerns about the reliability of the company's IT infrastructure and the impact on productivity. The IT team is under pressure to resolve the issue promptly and provide clear updates to reassure employees.",5127482141,3,
2024-02-24,1,4,closed,95597,Sharon Hall,sharon.hall@austx.com,Employees are encountering slow network speeds.,"A number of employees in a medium-sized enterprise have raised concerns about slow network speeds impacting their day-to-day work. Users have reported delays in accessing shared files, loading web pages, and connecting to remote servers. The IT helpdesk has received multiple tickets related to network performance issues and is currently investigating the underlying cause. Discussions are ongoing within the organization about potential solutions to improve network speed and efficiency to minimize disruptions to workflow.",5125773590,21,
2023-11-24,4,3,open,15050,Linda Anderson,linda.anderson@austx.com,"Network outage impacting multiple departments, Long Description: A network outage is currently impacting multiple departments within the medium-sized enterprise. Users are unable to connect to critical systems and applications, causing a significant disruption to daily operations. The IT team is working to identify the source of the outage and restore network connectivity to minimize the impact on productivity.",,5123982928,28,
2024-04-12,2,2,closed,49993,Nicholas White,nicholas.white@austx.com,"Network outage impacting email communication, Long Description: A network outage has occurred at a medium-sized enterprise, impacting email communication for employees. This has led to delays in responding to client inquiries and internal team collaboration. The IT team is working diligently to restore network connectivity and ensure that email services are back up and running smoothly. Employees are advised to use alternative communication channels in the meantime.",,5122891789,10,
2024-03-27,3,3,open,84510,George Roberts,george.roberts@austx.com,"Users are experiencing difficulties accessing email services. Long Description: Several employees in the marketing department at a medium-sized enterprise are reporting issues with accessing their email accounts. They are receiving error messages when trying to log in and are unable to send or receive emails. The IT team is investigating the issue to determine the root cause and resolve it as quickly as possible. Meanwhile, the affected employees are unable to carry out their daily tasks efficiently, leading to a decrease in productivity within the department. Discussions are ongoing between the IT team and the employees to provide updates on the progress of the investigation and to offer alternative communication solutions in the meantime.",,5129244699,9,
2025-02-07,1,4,closed,92899,James Martin,james.martin@austx.com,"Employees are unable to access shared network drives, impacting collaboration efforts.","A number of employees within the medium-sized enterprise have encountered difficulties in accessing shared network drives, which is hampering their ability to collaborate on projects and access important files stored on the company's network. The issue has been reported by users from various departments who rely on these shared drives for their day-to-day work. The IT support team is aware of the problem and is actively troubleshooting to identify the cause of the connectivity issue. In the meantime, employees are advised to utilize alternative methods for file sharing and collaboration to ensure minimal disruption to ongoing projects and tasks.",5123534966,7,
2023-12-31,4,2,open,46831,Rebecca Lee,rebecca.lee@austx.com,"Network outage impacting multiple departments, Long Description: A network outage has been reported within a medium-sized enterprise, impacting multiple departments' ability to access shared drives, applications, and the internet. Users have raised concerns about the disruption to their work and productivity. The IT team is actively working to identify the source of the outage and restore network connectivity across the affected areas. Employees are advised to remain patient while the issue is being addressed.",,5127122376,14,
2024-08-02,1,1,closed,10312,Gary Wright,gary.wright@austx.com,"Network outage affecting multiple departments, Long Description: A network outage is currently impacting multiple departments within the medium-sized enterprise. Users have reported connectivity issues with various applications and services. The IT team is working diligently to identify the root cause of the outage and restore network functionality to minimize disruption to business operations.",,5126796807,24,
2023-10-10,3,1,closed,75419,Joseph Sanchez,joseph.sanchez@austx.com,Employees are experiencing slow internet speeds in the office.,"Several employees at a medium-sized enterprise have raised concerns about experiencing slow internet speeds while working in the office. This issue is impacting their ability to collaborate effectively, attend virtual meetings, and access online resources necessary for their tasks. The IT team is currently investigating the network infrastructure to identify any bottlenecks or potential causes for the slowdown. In the meantime, employees are encouraged to report specific instances of slow internet speeds to help the IT team pinpoint the problem areas more efficiently.",5124214432,16,
2023-09-05,3,1,open,63309,Donna Brown,donna.brown@austx.com,"Users unable to access email, Long Description: Several users in the organization reported being unable to access their email accounts. The incident began early in the morning when employees tried to log in to their email client but received an error message indicating that the server could not be reached. The IT team was immediately alerted to investigate the issue. Upon further investigation, it was discovered that the email server was experiencing a critical hardware failure, leading to the disruption in service. The IT team quickly initiated the necessary steps to troubleshoot and resolve the issue, working diligently to restore email services for all affected users. During the incident, communication was sent out to all employees informing them of the problem and providing updates on the progress of the resolution. After several hours of intensive work, the email server was successfully restored, and users were able to access their accounts once again. The incident was thoroughly documented for future reference, and measures were put in place to prevent similar hardware failures from causing disruptions in the future.",,5122087049,2,
2023-08-23,2,1,closed,54142,Eric Carter,eric.carter@austx.com,"A network outage is impacting the company's ability to access shared files., Long Description: Employees at a medium-sized enterprise are currently unable to access shared files and documents due to a network outage. The issue has caused disruptions in collaborative work and project deadlines are at risk of being missed. The IT team is working to identify the source of the outage and restore network connectivity to minimize further impact on business operations. In the meantime, employees are advised to save their work locally and communicate with their team members through alternative means to ensure continuity in their tasks.",,5125042415,1,
2024-01-18,2,3,open,29363,Kathleen Torres,kathleen.torres@austx.com,"Network outage affecting multiple departments, Long Description: A network outage is currently impacting multiple departments within the organization, causing disruptions to daily operations. The IT team is actively working to identify the source of the issue and restore connectivity to all affected areas. Users are advised to limit network usage until the problem is resolved to prevent further complications.",,5122333600,28,
2023-10-01,2,1,closed,64520,Nancy Miller,nancy.miller@austx.com,Users are experiencing difficulty accessing the company's email server.,"Several employees at a medium-sized enterprise have reported issues with accessing their email accounts. Upon investigation, it was discovered that the company's email server was experiencing intermittent connectivity issues, causing delays in sending and receiving emails. The IT team is actively working to resolve the issue and restore normal email functionality for all users. In the meantime, employees have been advised to use alternative communication channels for urgent matters. Some users have expressed frustration over the inconvenience, while others have been understanding of the technical challenges being faced by the IT department. The IT team has provided regular updates to keep employees informed about the progress towards resolving the email server issue.",5125013179,2,
2023-06-26,4,2,closed,23Date,863,Steven Lee,steven.lee@austx.com,"Network outage affecting multiple departments, Long Description: A network outage has occurred in a medium-sized enterprise, impacting multiple departments and causing disruption to daily operations. Users across various teams are unable to access critical systems and applications, leading to a significant productivity loss. IT staff are actively investigating the issue to identify the root cause and restore network connectivity as soon as possible. Discussions among employees are centered around the impact on project deadlines and the need for contingency plans to mitigate the effects of the outage. The incident has highlighted the importance of robust network infrastructure and proactive monitoring to prevent similar disruptions in the future.",,5128890820,26
2024-02-16,3,4,open,48841,Betty Ramirez,betty.ramirez@austx.com,"Users are experiencing intermittent connectivity issues with the company's email server, Long Description: Several employees have reported intermittent connectivity issues when trying to access their email accounts through the company's server. The problem seems to be affecting users across different departments and locations within the organization. IT support has been notified and is currently investigating the root cause of the issue to restore normal email functionality. Meanwhile, employees are advised to periodically check for updates from the IT team regarding the ongoing investigation and possible solutions. Some users have resorted to using personal email accounts as a temporary workaround to ensure uninterrupted communication with clients and colleagues. The IT team is working diligently to resolve the issue and minimize any disruptions to the company's operations.",,5129856915,17,
2023-11-19,1,3,closed,49207,Daniel Thompson,daniel.thompson@austx.com,"Employees are experiencing slow internet connection at the office., Long Description: In a medium-sized enterprise, employees have been facing issues with slow internet connection at the office. Multiple users have reported that web pages are taking longer than usual to load, and some are experiencing intermittent connectivity issues while accessing online applications. The IT helpdesk has received several tickets regarding this issue, and the network team is investigating to identify the source of the problem. Users are growing increasingly frustrated as the slowdown is impacting their productivity.",,5128145277,15,
2023-08-03,4,2,closed,16115,Cynthia Rivera,cynthia.rivera@austx.com,Users are experiencing slow internet connection in the office.,"Employees in a medium-sized enterprise have reported experiencing slow internet connection while trying to access online tools and resources essential for their daily work tasks. The IT team has been alerted to investigate the issue and determine the root cause of the connectivity issue. Some employees have resorted to using their mobile data to continue working efficiently, but this is not a sustainable solution in the long run. The IT team is currently working on troubleshooting the network infrastructure to identify any potential issues causing the slow internet connection. Discussions are ongoing among employees in various departments about the impact of the connectivity issue on their productivity and the need for a swift resolution from the IT team to restore normal operations.",5129384153,24,
2024-05-03,1,4,closed,28321,George Jones,george.jones@austx.com,"Network connectivity issues affecting multiple departments, Long Description: A network connectivity issue is impacting multiple departments within a medium-sized enterprise. Users are experiencing slow internet speeds and intermittent outages, hindering their ability to access critical applications and collaborate effectively. The IT helpdesk is receiving a high volume of tickets from frustrated employees who are unable to complete their tasks due to the network issues. Some users are discussing the problem among themselves, sharing tips on potential workarounds while awaiting a resolution from the IT team. The IT team is actively troubleshooting the network problem to identify the cause and implement a fix to restore normal operations.",,5127312525,28,
2023-06-22,2,2,closed,24242,Paul Flores,paul.flores@austx.com,Users are reporting issues accessing the company's email server.,"Employees at a medium-sized enterprise have been experiencing difficulties accessing their email accounts through the company's server. Some users have reported receiving error messages when trying to log in, while others have said their emails are not syncing properly. The IT team is investigating the issue to determine the root cause and implement a solution to restore normal email functionality. Meanwhile, employees are advised to use alternative communication methods to ensure business continuity.",5129039781,26,
2025-02-20,3,1,closed,28211,Michelle Campbell,michelle.campbell@austx.com,"Network outage in the office, Long Description: A network outage has been reported in the office, causing disruptions to internet connectivity and access to shared drives. Employees across different departments are experiencing difficulties in carrying out their regular tasks that rely on network services. The IT team has been notified and is working on resolving the issue promptly to minimize the impact on business operations.",,5123157316,11,
2024-06-15,1,2,open,43869,Susan Nguyen,susan.nguyen@austx.com,"Users are unable to access the company's email system., Long Description: Several employees in a medium-sized enterprise reported that they were unable to access the company's email system. The issue seems to be affecting users across different departments and locations. Upon investigation, the IT team discovered that the email server was experiencing a technical glitch, causing the system to be inaccessible. The team is currently working on resolving the issue, and updates are being communicated to the employees through alternative communication channels such as instant messaging and phone calls. Some employees have expressed frustration over the inconvenience caused by not being able to access important emails and attachments, while others have been understanding of the situation and have resorted to using personal email accounts temporarily for work-related communication. The IT team is working diligently to restore the email system to full functionality as soon as possible to minimize the impact on business operations.",,5127265959,7,
2023-03-23,3,1,closed,78692,Amy Davis,amy.davis@austx.com,"Network outage impacting multiple departments, Long Description: A network outage has occurred in a medium-sized enterprise, impacting multiple departments and causing a halt in various business operations. Users are unable to connect to critical systems and applications, leading to a loss in productivity and potential revenue. The IT team is actively working to identify the source of the outage and restore network connectivity as soon as possible. Employees are expressing frustration over the lack of communication regarding the incident and the prolonged downtime. Management is closely monitoring the situation and providing updates to employees as the investigation progresses.",,5124376401,14,
2023-06-05,3,4,closed,52645,Ashley Rodriguez,ashley.rodriguez@austx.com,Users are experiencing slow internet connectivity at the office.,"Several employees at a medium-sized enterprise have reported experiencing slow internet connectivity at the office. This issue is affecting their ability to access important online resources, collaborate with team members, and complete their daily tasks efficiently. The IT team is investigating the root cause of the connectivity issue and working to resolve it as soon as possible. In the meantime, employees are advised to limit their bandwidth usage and prioritize essential work tasks to minimize the impact of the slow internet connection. Some users have resorted to using their mobile data or seeking alternative work locations with better connectivity to ensure productivity is not significantly impacted. The IT helpdesk is actively communicating updates to employees and providing troubleshooting tips to help them navigate through this challenging situation.",5123109375,14,
2024-12-31,2,2,open,21596,Richard Scott,richard.scott@austx.com,"Network connectivity issues affecting multiple departments, Long Description: Employees across various departments in our organization are experiencing network connectivity issues today. Some users are unable to access shared drives and applications, while others are reporting slow internet speeds. The IT helpdesk has been flooded with tickets related to the problem, and technicians are working diligently to identify and resolve the underlying cause of the network disruption. Colleagues have been advised to limit bandwidth-heavy activities until the issue is fully resolved to minimize further impacts on daily operations.",,5121388383,10,
2024-01-14,3,4,open,59894,Melissa Thomas,melissa.thomas@austx.com,"Network outage affecting multiple departments, Long Description: This morning, a network outage occurred at our office, impacting several departments within our organization. Employees were unable to access critical systems and files, causing disruption to daily operations. The IT team swiftly investigated the issue and identified a faulty network switch as the root cause of the outage. The switch was promptly replaced, and network connectivity was restored after a brief downtime. To prevent similar incidents in the future, the IT team will be conducting a thorough review of our network infrastructure and implementing redundancy measures.",,5129629824,28,
2024-12-05,2,3,open,31399,Andrew Nguyen,andrew.nguyen@austx.com,Users are experiencing difficulty accessing the company's internal network.,"Employees at a medium size enterprise are reporting issues with accessing the company's internal network. When attempting to log in, some users are receiving error messages indicating that their credentials are incorrect, despite entering the correct information. This has led to delays in completing important tasks and accessing necessary documents. The IT team is investigating the root cause of the network connectivity issue and working to resolve it promptly to minimize disruption to the business operations. In a discussion thread, users are sharing their experiences with the network problem and expressing frustration over the impact on their productivity. Some are suggesting potential workarounds while others are seeking updates from the IT department on the progress of the investigation. The incident is being closely monitored to ensure a swift resolution and restore normal network functionality for all employees.",5122613576,4,
2024-05-13,3,1,closed,21429,William Davis,william.davis@austx.com,Users are experiencing slow internet connectivity.,"Several users in the organization have reported experiencing slow internet connectivity when trying to access online resources and applications. The IT team is investigating the issue to determine the root cause and implement a solution to restore normal internet speeds. Some users have expressed frustration with the sluggish performance, impacting their ability to work efficiently. The IT helpdesk is actively communicating updates to users and working diligently to resolve the issue as quickly as possible.",5127679147,14,
2023-07-29,1,1,open,46901,Betty Robinson,betty.robinson@austx.com,Employees are unable to access certain shared folders on the network drive.,"A number of employees in a medium-sized enterprise have encountered problems accessing specific shared folders on the network drive. The affected folders contain crucial project files and documents that are essential for daily operations. IT support has identified that the issue stems from a permission misconfiguration, which is preventing certain users from accessing these folders. The IT team is actively working to rectify the permissions settings and restore access to the shared folders for all authorized users.",5124401320,30,
2024-06-26,3,4,open,63684,Michelle Rivera,michelle.rivera@austx.com,Users are experiencing slow internet connectivity at the office.,"Users at the medium-sized enterprise office have reported experiencing slow internet connectivity throughout the day. This issue is impacting productivity and causing frustration among employees who rely heavily on internet access to perform their daily tasks. The IT team has been alerted to investigate the root cause of the connectivity issue and is currently working to identify and resolve the issue promptly. In the meantime, employees are advised to limit bandwidth-heavy activities to help alleviate the strain on the network. Discussions are ongoing in the company's internal communication channels as employees share their experiences and seek updates on the progress of the IT team in resolving the issue.",5124110012,11,
2024-10-18,3,4,open,82974,Andrew White,andrew.white@austx.com,Some employees are reporting missing files from the company server. Long Description: A few employees at a medium-sized enterprise have raised concerns about missing files from the company server. The IT support team is working diligently to investigate the issue and recover any lost data to ensure minimal disruption to the business operations.,,5123720727,25,
