Priority,Urgency,Status,Incident Number,Requestor,Email,Short Description,Long Description,Phone,Days Open,,
2024-12-16,4,1,closed,24714,Elizabeth Hall,elizabeth.hall@austx.com,"Network outage reported impacting multiple departments, Long Description: A network outage has been reported at a medium-sized enterprise, affecting multiple departments within the organization. The incident began this morning when employees across various floors started experiencing connectivity issues with their computers and were unable to access shared drives or the internet. The IT team was immediately alerted and began investigating the root cause of the outage.",,5124640695,17,
2023-08-21,4,3,closed,47858,Helen Lopez,helen.lopez@austx.com,Customers are encountering errors when trying to place orders on the company's e-commerce platform.,"Several customers of a medium-sized enterprise have been facing errors and issues while attempting to place orders on the company's e-commerce platform. Some users have reported payment processing failures, while others have experienced difficulties adding items to their cart. The customer support team is actively working to resolve the technical issues and provide assistance to affected customers. Meanwhile, the IT department is conducting a thorough investigation to identify and address the underlying causes of the disruptions to ensure a seamless online shopping experience for all customers.",5124635703,13,
2024-12-03,3,2,closed,30036,Donald Thompson,donald.thompson@austx.com,Users are experiencing slow internet connection at the office.,"Several employees at a medium-sized enterprise have raised concerns about the slow internet connection at the office, impacting their ability to work efficiently. The IT team is investigating the issue to determine if it is a network infrastructure problem or if there are any specific issues with the service provider. Some users have suggested that the slow connection may be due to increased network traffic during peak hours, while others suspect potential hardware failures. Discussions are ongoing within the organization on how to best address and resolve the internet speed issue to minimize productivity disruptions.",5127920660,26,
2025-02-21,1,3,open,46521,Donna Gonzalez,donna.gonzalez@austx.com,Network connectivity issues are causing disruptions in the company's operations.,"Users in a medium-sized enterprise are experiencing network connectivity issues that are causing disruptions in their daily operations. Some employees are unable to access shared drives and applications, while others are facing slow internet speeds, making it difficult to work efficiently. The IT department is working to troubleshoot the network infrastructure to identify the source of the problem and implement a solution to restore stable connectivity for all users.",5125534322,21,
2024-07-24,4,4,closed,78894,Jessica Baker,jessica.baker@austx.com,"Network outage impacting multiple departments, Long Description: A sudden network outage has disrupted operations in multiple departments of the company. Users are unable to connect to critical systems and access shared drives. The IT helpdesk has been flooded with support requests as employees try to resume their work. The network team is working diligently to identify and resolve the issue as quickly as possible.",,5128139427,14,
2025-02-25,2,4,closed,45202,Dorothy White,dorothy.white@austx.com,Network outage impacting multiple departments.,A network outage has disrupted operations for various departments within a medium-sized enterprise. Users have reported being unable to connect to critical systems and access shared files. The IT team is actively working to identify the source of the outage and restore network connectivity to minimize the impact on business operations. Colleagues are communicating via alternative channels to coordinate efforts and provide updates on the situation.,5121510043,12,
2023-10-05,2,1,closed,29403,Jessica Thomas,jessica.thomas@austx.com,Users are experiencing slow internet connection at the office.,"Several employees at the medium-sized enterprise have reported experiencing slow internet connection while trying to access online resources and applications. The IT team has been alerted to investigate the issue further. Upon initial assessment, they found that the network bandwidth was being heavily utilized during peak hours, causing the slowdown in internet speed. The team is now working on optimizing the network settings and exploring potential upgrades to accommodate the increasing demand for bandwidth within the organization. In the meantime, employees have been advised to stagger their usage of bandwidth-intensive applications to alleviate the strain on the network.",5122754969,17,
2023-05-18,3,4,closed,25592,Amy Young,amy.young@austx.com,Users are experiencing slow internet connection at the office.,"Several employees at a medium-sized enterprise have reported experiencing slow internet connection at the office. This issue has been ongoing for the past few days, impacting their ability to work efficiently. Some users have mentioned that web pages take longer than usual to load, and there are delays in sending and receiving emails. The IT team has been notified about the problem and is currently investigating the root cause. Discussions among employees have highlighted the frustration caused by the sluggish internet speed, with some suggesting possible solutions such as upgrading the network infrastructure or contacting the service provider for assistance.",5129827314,11,
2023-08-19,2,4,open,83559,David Lewis,david.lewis@austx.com,"Users are reporting issues accessing email services., Long Description: Several users in the medium-sized enterprise are reporting difficulties accessing their email services. The IT team is investigating the issue to determine the root cause. Meanwhile, employees are unable to send or receive important emails, impacting their productivity. The IT helpdesk is receiving multiple tickets and calls related to this issue, causing a backlog in resolving other IT-related problems. The team is working diligently to identify and resolve the email service disruption as quickly as possible to minimize the impact on the organization's operations.",,5125822799,4,
2024-10-14,2,2,open,71028,Dorothy Hill,dorothy.hill@austx.com,"Email server experiencing delays, Long Description: Users across the organization have been experiencing delays in sending and receiving emails due to issues with the email server. The IT team is aware of the situation and is actively working on resolving the issue. Some users have reported that important communications are being delayed, causing disruptions to their workflow. Discussions are ongoing in the company chat channels about the impact of the email delays on various projects and deadlines.",,5124349707,26,
2024-03-07,4,3,closed,32481,Anna Anderson,anna.anderson@austx.com,Network connectivity issues in the office.,"Users in a medium-sized enterprise office are experiencing intermittent network connectivity issues, leading to slow internet speeds and difficulty accessing shared drives and cloud-based applications. The IT helpdesk has received multiple reports from frustrated employees who are unable to work efficiently due to the network disruptions. IT personnel are actively troubleshooting the issue, checking network infrastructure components such as routers, switches, and access points to identify and resolve the underlying cause of the connectivity problems. Users are advised to limit bandwidth-heavy activities until the issue is fully resolved to minimize further impact on productivity.",5129140888,16,
2023-04-23,4,4,closed,70283,Amy Roberts,amy.roberts@austx.com,"Users experiencing intermittent connectivity issues with company's email server, Long Description: Several employees at a medium-sized enterprise have reported intermittent connectivity issues when trying to access their company email accounts. The problem seems to be impacting users across different departments and locations within the organization. Some users have mentioned that they are unable to send or receive emails consistently, while others have experienced delays in receiving new emails. The IT team is currently investigating the root cause of the issue to restore normal email functionality for all employees. In a discussion thread on the company's internal communication platform, employees have been sharing their experiences with the email connectivity problems. Some have suggested potential workarounds, such as accessing emails through mobile devices or using alternative communication channels for urgent messages. The IT department has assured employees that they are actively working on resolving the issue and will provide updates as soon as more information becomes available.",,5124113584,16,
2025-03-04,4,2,closed,27872,Kenneth Lewis,kenneth.lewis@austx.com,Users are experiencing slow internet speeds in the office.,"Employees at a medium-sized enterprise have reported experiencing slow internet speeds while trying to access online resources and applications. The IT team has been investigating the issue, checking network configurations, running speed tests, and monitoring network traffic. Despite their efforts, the cause of the slowdown remains unclear. Users have expressed frustration as the sluggish internet connection is impacting their productivity. Some have resorted to using their mobile data to complete tasks, leading to concerns about security and data usage. The IT team is working diligently to identify and resolve the root cause of the slow internet speeds to ensure smooth operations for all employees.",5124923449,15,
2023-12-30,3,2,closed,79256,Charles Hall,charles.hall@austx.com,"Data breach incident reported by the IT team, Long Description: The IT team in a medium-sized enterprise reported a data breach incident where sensitive customer information was compromised. This incident raised concerns about data security and potential regulatory implications. The IT team swiftly initiated a response plan, including containing the breach, assessing the impact, and notifying the affected individuals. Discussions among stakeholders ensued to strengthen cybersecurity measures and prevent future breaches.",,5127226832,2,
2023-06-07,4,3,open,96370,Ronald Rodriguez,ronald.rodriguez@austx.com,Employees unable to access company network due to server outage.,"Employees at a medium-sized enterprise are reporting that they are unable to access the company network. Upon investigation, it is discovered that there is a server outage causing the disruption. The IT team is working diligently to identify the root cause of the issue and restore access to the network as soon as possible. In the meantime, employees are advised to continue working offline and avoid any network-dependent tasks. This incident is impacting productivity across multiple departments, and updates are being communicated to employees regularly to keep them informed of the progress towards resolution.",5125451174,27,
2023-11-04,2,1,open,45576,Nicholas Smith,nicholas.smith@austx.com,Users are experiencing slow network connectivity in the office.,"Employees in a medium-sized enterprise have been reporting slow network connectivity issues while trying to access shared files and applications. The IT team has been investigating the root cause of the problem, checking network infrastructure components such as switches, routers, and cables. Despite their efforts, the issue persists, causing frustration among employees who rely on a fast and stable network to carry out their daily tasks. As the IT team continues to troubleshoot the issue, employees are resorting to using personal hotspots and mobile data to maintain productivity, highlighting the urgency of resolving the network connectivity issue promptly.",5123866451,5,
2023-10-11,2,1,open,18609,Jessica Wilson,jessica.wilson@austx.com,"Email server down, Long Description: The email server in a medium-sized enterprise is currently experiencing downtime, preventing employees from sending or receiving emails. This issue is causing delays in communication and collaboration across different teams within the organization. IT support has been alerted and is actively investigating the cause of the email server outage to implement a swift resolution.",,5125911215,18,
2023-03-18,4,4,open,42639,Elizabeth Lopez,elizabeth.lopez@austx.com,"Slow performance on company website, Long Description: Users have been experiencing slow performance while accessing the company website in a medium-sized enterprise. This issue has been causing frustration among employees and customers trying to access information or make transactions online. The IT team is investigating the performance bottleneck and working to optimize the website for improved speed and reliability.",,5122520938,15,
2025-02-28,1,2,open,78055,Linda Baker,linda.baker@austx.com,"Slow performance on company laptops., Long Description: Several employees in a medium-sized enterprise have reported slow performance on their company-issued laptops. Users are experiencing delays in opening applications, accessing files, and general sluggishness in overall system responsiveness. Some employees have also mentioned occasional freezes and crashes while working on important tasks. IT support has been informed and is working to diagnose the underlying cause of the performance issues, which could be related to software conflicts, insufficient system resources, or potential malware infections.",,5124970405,11,
2023-12-26,2,4,closed,56996,Deborah Hall,deborah.hall@austx.com,Difficulty accessing shared drive causing delays in project collaboration.,"Users at a medium size enterprise are experiencing difficulty accessing the shared drive where project files are stored. This is causing delays in project collaboration as team members are unable to access and update important documents. The IT team is currently investigating the issue and working to restore access to the shared drive as soon as possible. Some users have resorted to using personal email accounts to share files temporarily, but this workaround is not sustainable for long-term collaboration efforts.",5122495129,21,
2024-09-30,1,2,open,48988,Christopher Harris,christopher.harris@austx.com,"Users unable to access email services., Long Description: Several users in the organization are reporting that they are unable to access their email accounts. This issue is impacting employees across multiple departments and locations. The IT team is investigating the root cause of the problem and working to restore email services as soon as possible. In the meantime, employees are unable to send or receive emails, causing disruptions to their daily work tasks. Some users have resorted to using personal email accounts to communicate with colleagues and clients, which raises security concerns for the organization. The IT helpdesk has been inundated with support requests related to the email outage, and employees are growing increasingly frustrated with the lack of communication about the issue. The IT team is under pressure to resolve the issue quickly and provide updates to keep the workforce informed about the progress.",,5128746814,1,
2024-03-08,4,1,open,89783,Angela Baker,angela.baker@austx.com,"Network outage affecting multiple departments, Long Description: A network outage occurred at a medium size enterprise, impacting several departments including Sales, Marketing, and Customer Service. Users were unable to access critical applications and files, leading to a significant disruption in daily operations. IT teams quickly identified the issue as a faulty switch in the data center and worked to replace it to restore connectivity. The outage lasted for approximately two hours, causing frustration among employees who were unable to complete their tasks. As a result, the IT department implemented additional monitoring measures to prevent similar incidents in the future.",,5126578659,21,
2023-07-13,4,3,open,56116,Timothy Ramirez,timothy.ramirez@austx.com,Payment processing system experiencing delays.,Several employees at a medium-sized enterprise have noticed delays in the payment processing system when trying to complete transactions. This issue is impacting the finance team's ability to efficiently manage payments and reconcile accounts. IT support has been notified and is working to identify and resolve the underlying cause of the delays to ensure smooth operations for the company.,5126138095,14,
2024-09-08,3,3,closed,95063,John Miller,john.miller@austx.com,"Network outage affecting multiple departments, Long Description: Users across various departments in a medium-sized enterprise have been experiencing network connectivity issues since this morning. The IT helpdesk has been flooded with reports of slow internet speeds, intermittent disconnections, and inability to access shared drives. The IT team is currently working to identify the source of the network outage and restore normal operations as soon as possible. Meanwhile, employees are advised to limit their use of network resources to essential tasks only to minimize the impact of the outage on business operations.",,5122232754,3,
2024-04-01,3,1,open,61775,Betty Young,betty.young@austx.com,"Network outage causing loss of connectivity to critical systems, Long Description: A network outage occurred today, resulting in a loss of connectivity to critical systems for a medium-sized enterprise. The incident was first reported by the IT team when users across multiple departments started experiencing issues accessing shared drives, email servers, and internal applications. The network team immediately began investigating the root cause of the outage.",,5122873405,26,
2024-05-17,2,3,open,41872,Barbara Hill,barbara.hill@austx.com,"Email server downtime causing delays in communication, Long Description: Users across the organization reported issues with sending and receiving emails due to an unexpected downtime of the email server. This led to delays in communication both internally and externally, impacting project timelines and customer interactions. The IT support team immediately started investigating the root cause of the server downtime and worked diligently to restore email services to minimize the impact on business operations.",,5121933185,25,
2025-02-14,1,2,closed,82743,William Adams,william.adams@austx.com,"Users unable to access email after system update, Long Description: Several users in a medium-sized enterprise reported being unable to access their email accounts following a recent system update. The issue seems to have started after the update was applied last night. Users are receiving error messages stating that their credentials are incorrect, even though they have not changed their passwords. The IT team is investigating the issue to determine the root cause and find a resolution as quickly as possible. ",,5127988568,6,
2024-07-26,1,4,closed,72117,Dorothy Robinson,dorothy.robinson@austx.com,Network connectivity issues impacting multiple departments.,"Several departments within the medium-sized enterprise are experiencing network connectivity issues, causing disruptions to their daily operations. Users have reported slow internet speeds, intermittent connection drops, and difficulty accessing shared drives and applications. The IT team is actively troubleshooting the network infrastructure to identify the source of the problem and restore stable connectivity for all affected users.",5121137819,11,
2023-08-28,2,3,closed,22729,Robert Sanchez,robert.sanchez@austx.com,Users are experiencing intermittent connectivity issues to the company's email server.,"Some users in the company have been reporting intermittent connectivity issues when trying to access their emails. The problem seems to be affecting users across different departments and locations. The IT team is currently investigating the root cause of the issue to ensure that all employees can access their emails smoothly. As the problem persists, employees are advised to check for any updates from the IT department regarding the ongoing investigation.",5125591430,3,
2025-02-20,1,1,open,76774,Ashley Anderson,ashley.anderson@austx.com,"Slow internet connection impacting productivity, Long Description: Several employees in a medium-sized enterprise have been experiencing a slow internet connection for the past few hours, leading to delays in completing tasks and accessing online resources. Users have reported frustration and decreased productivity as a result of this issue. The IT team is currently investigating the network infrastructure to identify and resolve the cause of the slow connection.",,5122678100,21,
2023-12-31,1,3,open,36989,Andrew Nguyen,andrew.nguyen@austx.com,"Users unable to access email, Long Description: Several users in the organization reported being unable to access their email accounts. The incident began early in the morning when employees tried to log in and received an error message stating that their credentials were invalid. The IT team was immediately alerted and began investigating the issue. After initial troubleshooting, it was discovered that the email server was experiencing technical difficulties, causing the authentication process to fail for some users. The IT team quickly escalated the issue to the email service provider and worked with them to resolve the problem. Throughout the day, users were kept informed of the progress and were provided with temporary workarounds to ensure minimal disruption to their workflow. By the afternoon, the email service was fully restored, and users were able to access their accounts without any further issues.",,5129284463,5,
2024-06-16,3,2,open,22817,Stephen Torres,stephen.torres@austx.com,Several employees are unable to access important files on the shared drive.,"A number of employees within a medium-sized enterprise have reported that they are unable to access critical files stored on the company's shared drive. This issue is hindering collaboration and impacting productivity as team members are unable to retrieve essential documents needed for ongoing projects. The IT support team has been notified and is actively investigating the root cause of the access issue. In the meantime, affected employees are advised to reach out to their colleagues for file sharing assistance and to ensure that all work is backed up locally to prevent data loss.",5121644590,29,
2024-12-05,4,1,open,37578,Margaret Hill,margaret.hill@austx.com,"Users unable to access email due to server outage, Long Description: Several employees at a medium-sized enterprise reported being unable to access their email accounts. Upon investigation, it was discovered that there was a server outage causing the email system to be down. The IT team immediately started working on resolving the issue to minimize disruption to the business operations. As the outage persisted, employees began to express frustration as they were unable to communicate with clients and colleagues effectively. The IT team provided regular updates to the employees, assuring them that they were working diligently to restore the email service. After a few hours of troubleshooting, the server issue was identified and resolved, and the email system was back up and running smoothly. Post-incident, a meeting was held to discuss ways to prevent similar outages in the future, including implementing redundant systems and conducting regular maintenance checks.",,5125052129,1,
2024-03-14,3,1,closed,96024,Anthony Harris,anthony.harris@austx.com,"Users experiencing slow system performance., Long Description: Several users in a medium size enterprise have reported experiencing slow system performance, leading to delays in completing their tasks. The IT team is analyzing the network and server infrastructure to pinpoint the source of the performance degradation and implement necessary optimizations.",,5127408622,7,
2024-11-04,1,1,open,84431,Linda Anderson,linda.anderson@austx.com,"Network outage affecting multiple departments, Long Description: A network outage is currently impacting multiple departments within our medium-sized enterprise. Users have reported connectivity issues and inability to access shared drives and applications. The IT team is actively working to troubleshoot the problem and restore network services to minimize disruption to business operations.",,5127667580,26,
2024-09-08,4,3,closed,71132,Michael Green,michael.green@austx.com,"Network outage affecting multiple departments, Long Description: A network outage has impacted multiple departments within a medium-sized enterprise, leading to a halt in critical operations. Users across various teams have reported being unable to access shared drives, internal applications, and internet services. The IT support team is actively working to identify the source of the outage and restore network connectivity as soon as possible. In the meantime, employees are advised to limit non-essential internet usage to alleviate strain on the network infrastructure.",,5124923215,14,
2024-09-22,2,3,open,35469,Anthony Mitchell,anthony.mitchell@austx.com,"Network outage affecting multiple departments, Long Description: A network outage is currently impacting multiple departments within a medium-sized enterprise. Users across different floors of the office building have reported being unable to connect to the internet or access shared drives. The IT helpdesk has been inundated with calls from frustrated employees seeking assistance. The IT team is working diligently to identify the source of the outage and restore network connectivity to minimize disruption to the business operations.",,5127800092,18,
